Sheet: temperature_controller_BOM
A1: Project box | B1: Organize | C1: 80844060569 | D1: 2011-08-15T00:00:00.000 | E1: =1.99+8.99/3 -> 4.9866666666666664 | F1: 1 | G1: =RC[-1]*RC[-2] -> 4.9866666666666664
A2: Standoffs and hardware | B2: Cables & Connectors | C2: 9604 | D2: 2012-01-24T00:00:00.000 | E2: 1 | F2: 6 | G2: =RC[-1]*RC[-2] -> 6
A3: Nokia LCD display | B3: SparkFun | C3: LCD-10168 | D3: 2011-07-11T00:00:00.000 | E3: 9.95 | F3: 1 | G3: =RC[-1]*RC[-2] -> 9.95
A4: pushbutton switch | B4: Mouser | C4: 506-MSPS103C0 | D4: cbm120105 | E4: 2.54 | F4: 3 | G4: =RC[-1]*RC[-2] -> 7.62
A5: ribbon cable | E5: 0.2 | F5: 2 | G5: =RC[-1]*RC[-2] -> 0.4
A6: phone jack | B6: Mouser | C6: 161-3144M-E | D6: cbm120105 | E6: 0.95 | F6: 3 | G6: =RC[-1]*RC[-2] -> 2.8499999999999996
A7: phone plug | B7: Mouser | C7: 568-NYS226 | D7: cbm120105 | E7: 0.74199999999999999 | F7: 3 | G7: =RC[-1]*RC[-2] -> 2.226
A8: Twisted cable for power switches | B8: Mouser | C8: 566-8451-100 | D8: cbm120105 | E8: =27.21/100 -> 0.27210000000000001 | F8: 24 | G8: =RC[-1]*RC[-2] -> 6.5304000000000002
A9: Powerswitch Tail | B9: SparkFun | C9: COM-10747 | E9: 21.95 | F9: 3 | G9: =RC[-1]*RC[-2] -> 65.85
A10: 4P4C jack | B10: Mouser | C10: 806-GLX-A-44 | D10: cbm120105 | E10: 0.45 | F10: 3 | G10: =RC[-1]*RC[-2] -> 1.35
A11: 4P4C connectors | B11: Cables & Connectors | D11: 2012-01-24T00:00:00.000 | E11: =10.95/100 -> 0.10949999999999999 | F11: 3 | G11: =RC[-1]*RC[-2] -> 0.32849999999999996
A12: Cat3 cable for thermistors | B12: Home Depot | E12: =80/1000 -> 0.08 | F12: 24 | G12: =RC[-1]*RC[-2] -> 1.92
A13: Thermistor NTC | B13: DigiKey | C13: 490-4653-ND | D13: 2011-02-10T00:00:00.000 | E13: 0.79 | F13: 3 | G13: =RC[-1]*RC[-2] -> 2.37
A14: Power supply | B14: Adafruit | C14: 63 | D14: 2011-11-17T00:00:00.000 | E14: 6.95 | F14: 1 | G14: =RC[-1]*RC[-2] -> 6.95
A15: Barrel power connector | B15: Jameco | C15: GCD014-R | E15: 0.45 | F15: 1 | G15: =RC[-1]*RC[-2] -> 0.45
A16: Small power plug for Seeeduino | B16: Jameco | C16: 22-01-3027 | E16: 0.15 | F16: 1 | G16: =RC[-1]*RC[-2] -> 0.15
A17: Seeeduino | B17: SeeedStudio | C17: ARD128D2P | D17: 2011-08-08T00:00:00.000 | E17: 22.5 | F17: 1 | G17: =RC[-1]*RC[-2] -> 22.5
A18: Wing shield | B18: Adafruit | C18: 196 | D18: 2011-11-17T00:00:00.000 | E18: 16 | F18: 1 | G18: =RC[-1]*RC[-2] -> 16
A19: RTC and Data Logger shield | B19: Adafruit | C19: 243 | D19: 2011-11-17T00:00:00.000 | E19: 19.5 | F19: 1 | G19: =RC[-1]*RC[-2] -> 19.5
A20: 1GB SD card | E20: 8.5 | F20: 1 | G20: =RC[-1]*RC[-2] -> 8.5
A21: Prototyping perfboard | B21: Radio Shack | C21: 276-147 | E21: 3.99 | F21: 1 | G21: =RC[-1]*RC[-2] -> 3.99
A22: 28-pin DIP socket | B22: Mouser | C22: 517-4828-3004-CP | D22: cbm120105 | E22: 0.28 | F22: 3 | G22: =RC[-1]*RC[-2] -> 0.84000000000000008
A23: Ardweeny | B23: MakerShed | C23: MKSB012 | D23: 2011-10-12T00:00:00.000 | E23: 16 | F23: 3 | G23: =RC[-1]*RC[-2] -> 48
A24: Water circulator pump | B24: Amazon | C24: VA-80 | D24: 2011-08-15T00:00:00.000 | E24: 9.35 | F24: 3 | G24: =RC[-1]*RC[-2] -> 28.049999999999997
A25: Crock pot | D25: tag sale | E25: 9 | F25: 1 | G25: =RC[-1]*RC[-2] -> 9
G28: =SUM(R[-27]C:R[-3]C) -> 276.31156666666669